question	answer
单元式幕墙单元组件的收口如何处理更好？	单元式幕墙单元组件间靠对插完成接缝，在安装时要横向按次序一一对插，当中不能留空位（因为对插接缝无法平推进入空位），最后一个单元如何与相邻两单元连接是一个难点，因为已安装固定的左右两单元组件之间距离净空比单元组件实际宽度要小，这个组件无法在水平方向平推进入空位，也不能先插一侧再插另一侧，这样在设计时，对最后一个单元组件的组装要考虑好接缝方法，（现在一般采用的方法为从上向下插最后一块或用先固定相邻两不带对插件的组件，定位固定后插入第三者完成接缝，第三者与单元组件要错位插接，达到互为封口），由于收口处理技术比较复杂，因此最好每层设一处收口点，这就要求在设计时就确定好收口点位置及相应的收口方法，非设计收口部位不能中断安装过程而留空位，在编制施工组织设计（全部土建工程而不是幕墙工程分部的施工组织设计）时，特别是总施工平面图设计时要注意到单元式幕墙横向一、一对插的特点，将施工机具布置在单元式幕墙收口部位，不能任意布置，因为高层建筑的塔吊、施工电梯等施工机具，每隔三层左右要和主体结构拉接一次，这些接拉件将使单元组件无法通过而中断安装，留下空位，要待这些机具拆除后才能收口，难度就相当大，即使采取一些临时措施，效果也不会理想。因此对采用单元式幕墙的建筑，在编制总施工组织设计时，总施工平面图要按单元式幕墙组装规律，将施工机具布置在单元式幕墙收口部位。回答时间：2012-3-22
单元式幕墙接缝封口方法有哪些？	现在封口方法有两种类型：即横滑型和横锁型，横滑型是在下单元上框中设封口板，此封口板除了具有封口功能外，还是集水槽和分隔板（把竖框分隔成每层一个单元）。横滑型封口板嵌在下单元上框母槽内，它比上单元下框公槽大，上单元下框可以在封口板槽内自由滑动，在主体结构层间变位时原来上下一、一对齐的两单元组件，在主体结构层间变位影响下，上下两层发生相对位移，这时候上单元组件不再定位在原来对齐的下单元组件上框中，而有可能局部滑入相邻组件的上框，由于这种滑动，在地震中单元组件本身平面内变形比主体结构层间位移小。但在地震时单元式幕墙不像拟静力试验中只有同向运动而是随机运动，即在地震发生的最初阶段是同向运动，以后陆续发生异向运动，即相向运动和背向运动，相向运动时可能会发生相邻两单元接缝处杆件碰撞；背向运动时，相邻两单元接缝拉开，由于三维地震作用影响，拉开后恢复时杆件错位而碰撞，因此《高层钢结构设计施工规程》第九章规定幕墙与主体结构连接设计应考虑防碰撞问题。横滑型封口板的集水、排水功能比较成熟，如果设计得好，则可大大提高幕墙水密性能，即可以达到超高性能（2500Pa）水平。但这种封口板只能用于相邻两单元180度对插，即只能用于处于一个平面上的单元组件，如果两单元组件成折线或90度对插，封口板就无法使用，同时这种封口板搁在上框底板上，两相邻组件上框底板构造厚度部份封口板无法封口，要采用辅助封口措施（用胶带纸粘贴在竖框顶端形成底板，再注胶密封）。????横锁型是在接缝处竖框空腔中设一个多功能插芯，这种插芯由两部份组成，对插的封口部份和一个向上开口其它五面封闭的集水壶组成，对插部份位于四单元交接处，集水壶位于下部，它集封口、集水、分隔于一身（分隔将横向空腔分成每一单元组件宽一单元），横锁型由于位于上下两单元交接处，将上下两单元组合成一个整体，左右相邻两单元不能滑动，且单元组件固定在主体结构上，它的平面内变形与主体结构的层间变位几乎相同。从试验情况看，它的集水排水功能尚不理想，但它可用于单元组件任何角度对插，且由于插芯将上下两单元固定，左右两单元组件不能运动，所以不会发生碰撞。回答时间：2012-3-22
单元式幕墙接缝的特点是？	元件式（元件单元式）幕墙的接缝均在一个整体杆件上，这个杆件挤压时就是一个整体杆件，上墙安装时先安装杆件，此时由于尚未安装面板，人可在外侧操作，对杆件进行调整、定位后固定，在杆件安装定位固定后再安装面板。????单元式幕墙在工厂已将单元组件制作完成，即面板已安装在单元组件框上，而单元组件与主体结构的连接构件安装在单元组件内侧，在吊装时单元组件与主体结构的连接必须在内侧操作。单元组件间接缝靠相邻两单元组件相邻框对插组成组合杆完成接缝，即它不是在一个整体杆件上接缝，而是靠对插组成组合杆完成接缝。回答时间：2012-3-20
如何在点式全玻璃幕墙上开窗与开门？	传统的做法是在门洞处设钢构架，索桁架锚固定在门洞口钢构架上，再在钢构架上安装门扇，达到开门的目的。现在可以直接在玻璃墙面上开单扇小门和窗。门采用平开门，用点式铰链连接，一边铰链用沉头螺栓固定在门侧墙面玻璃上，一边用沉头螺栓固定在玻璃门扇上，用抽芯将两边铰链连接形门，但要注意采取防水措施即在幕墙玻璃门洞上方用胶接固定玻璃披水（披水此门洞每边大100mm），使上方没玻璃下排的水由披水排掉，不接触门扇上边缝隙。在门扇两侧接缝处打一三角胶缝将接缝封闭，这样才能防止雨水从门边接缝渗入室内。窗采用上悬窗，用点式连接铰链，一边固定在窗上方墙面玻璃上，一边固定在窗扇上，用抽芯连接形成窗，同样在窗上方墙面玻璃设玻璃披水（用透明胶固定）披水两边各比窗洞大100mm。窗扇玻璃与幕墙玻璃接缝处注三角形胶缝，防止雨水渗入，其中下方胶缝最好要盖住墙玻璃2-3mm，效果更好。回答时间：2012-3-20
点式玻璃装配体系有哪些？	一般点式玻璃装配系统是在桁架（杆件）上装钢爪，再在钢爪上安装固定式（活动式）连接件，再用浮头（沉头）螺栓将玻璃固定，所谓筒式点式装配，是趋势在杆件上焊两上耳子，耳子打孔以代替钢爪，玻璃用沉头连接螺栓固定在耳子上，形成墙面（屋面）系统。还有一种用在雨蓬上的筒式装配体系，它在玻璃四个角开孔（转角处在尖部再开一个孔），将沉头螺栓穿过玻璃开孔与拉杆连接，拉杆固定在墙面上，将玻璃挂起形成雨蓬，有过这只能用于风荷载小的地区，因为雨蓬在风运动过程中会因吸力而向上运动，它完全靠玻璃自重平衡，当风吸力超过自重时，雨蓬可能会上翻破坏。回答时间：2012-3-20
断桥铝合金推拉门如何清洁和保养？	1、推拉门的边框多为金属材料，日常清洁时用干的纯棉抹布擦拭即可。若用水清洁，应该尽量拧干抹布，以免金属表面损坏，影响美观。　　2、推拉门门板多为玻璃或高密度板。对于玻璃门板，平日经常用干抹布擦拭即可，每隔一段时间，用稀释过的中性洗涤剂或玻璃专用洗涤剂，然后用干的纯棉、不掉毛的抹布擦干；对于高密度板，不宜用一般洗涤剂擦洗，经常用干的纯棉抹布擦拭即可，如果用水清洁，注意一定要用干的纯棉抹布擦干。　　3、底轨容易积存浮尘，它直接影响底轮的滑动，从而影响推拉门的使用寿命，因而平时要注意经常使用吸尘器清除底轨浮尘，边角处用抹布蘸水清洁，同时注意用不掉毛的纯棉布擦干。回答时间：2012-1-11
同档次断桥铝合金门窗与不锈钢窗哪个造价高些？	当然是隔热断桥铝门窗。工序多，材料贵、回答时间：2011-12-30
断桥隔热铝材的米重怎么计算？	穿条型材：01（型材）+02（型材）+胶条重量；注胶型材：型材铣段后的重量+胶条重量。胶条种类也比较多，常用的“I”型条每支每米的重量是0.046KG；“C”型条每支每米的重量是0.055KG；“O”型条每支每米的重量是0.064KG。回答时间：2011-12-30
断桥铝门窗为什么隔热性好呢？	"因为断桥铝门窗型材是用隔热性能良好的尼龙条连接成的,从而阻断了原本导热性比较高的纯铝合金型材的导热路线。回答时间：2011-12-30"
断桥铝采用哪种铝？密度是多少？	隔热铝合金型材主要特点是隔热、隔音、达到环保、节能要求，而这种特点正符合国际和国内的产业政策。?所谓隔热铝合金型材，即内、外层由铝合金型材组成，中间由低导热性能的非金属隔热材料连接成“隔热桥”的复合材料，简称隔热型材。?隔热型材的生产方式主要有两种，一种是采用隔热条材料与铝型材，通过机械开齿、穿条、滚压等工序形成“隔热桥”，称为隔热型材“穿条式”；另一种是把隔热材料浇注入铝合金型材的隔热腔体内，经过固化，去除断桥金属等工序形成“隔热桥”，称为“浇注式”隔热型材。回答时间：2011-12-30
穿条式隔热铝合金型材收费标准？	这个各地区是不一样的，我才做的门窗，每平方米160元。回答时间：2011-12-30
保温、隔热铝合金门窗有什么质量要求？	建筑物的门窗是建筑物外围结构的组成部分，是建筑物热交换最敏感的部位，其单位面积能耗是墙体的5~6倍，门窗的热能损失占整个建筑物的40％以上。建筑物外门窗的热量损耗有三个途径：第一，通过铝合金型材的热量传导损失；第二，通过玻璃的辐射热量损失；第三，通过门窗缝隙的空气对流热量损失。因此，保温节能铝合金门窗的制作也要从这三个方面考虑。　　1、铝合金型材　　铝合金材料是热的良导体，热导率多数比较高。要制成保温隔热玻璃，要选择有隔热断桥处理的型材，即隔断型材热传导的通路，以达到保温隔热的目的。　　2、玻璃　　保温隔热门窗需要采用中空玻璃，因为中空玻璃之间的空腔内充满干燥、静止的空气，使热导率大大降低，因此中空玻璃具有优良的隔热、隔声和抗霜凝、结露性能，常用的中空玻璃的玻璃厚度5~6mm，常见的空腔厚度有9mm、12mm。　　3、密封材料　　保温隔热门窗用的密封胶应选用耐候胶，密封胶条应选用抗臭氧腐蚀性能及抗紫外线老化性能优良的氯丁橡胶制品，门窗扇开启重合部分要设置三道以上密封胶条。回答时间：2012-1-11
塑钢窗有什么优点？	1.塑钢窗可加工性强?在熔融状态下，塑料有比较高的流动性，因此通过模具可以形成精确的断面构造，从而实现窗应具备的功能需要。而且可以形成分割的腔室，以提高成窗的保温，隔音，排水的功能，可以避开增强型钢的锈蚀。2.塑钢窗节能?塑料窗比其他窗在节能和改善室内热环境方面，有更为优越的技术特性。据建研院物理所测试，单玻钢，铝窗的传热系数为64W/M2K；单玻塑钢窗的传热系数是47W/M2K左右；普通双层玻璃的钢，铝窗的传热系数是3。7W/M2K左右；而双玻塑料钢窗传热系数约为2。5W/M2K。窗占建筑外围护结构面积的30％，其散热量占49％，由此可知，塑钢窗有很好的节能效益。3.塑钢窗隔音好钢铝窗的隔音性能约为19分贝，塑钢窗的隔音性能可达到30分贝以上。在日益嘈杂的城市环境中，使用塑钢窗可使室内环境更为舒适。据日本提供的资料介绍，要达到同样降低噪音的要求，安装铝窗的建筑物与交通干道的距离必须达到50米，而安装塑钢窗达到18米即可。根据北京市劳动保护研究所的检测，使用塑钢窗的室内噪音降到32DB（A），效果是非常好的。由于经济的发展，城市噪音问题越来越严重，而塑钢窗对于改善人们居住和工作的音环境质量是会提供较大贡献的。另外塑钢窗耐腐蚀，可用在沿海，化工厂等腐蚀环境中，普通用户使用也能减少维护油漆的人工和费用。4.塑钢窗外观好?能和国内的装饰效果要求相适应，而且人体接触感觉比金属的舒适。由于塑钢窗有以上的一些突出优点，在我国正在得到大量应用，成为建筑领域的新潮流。5.塑钢窗成本低?和铝合金窗相比，同等使用效能的塑钢窗比铝合金节省成本30％-60％，这是塑钢窗得以普及的最主要原因。回答时间：2011-12-26
铝合金门窗如何选择材料?	1、铝合金型材必须符合GB/T?5237－2400《铝合金建筑型材》的要求。2．五金配件的选择和配置是保证门窗质量的重要因素之一。即便是性能优良的窗型，也必须靠优质配件的选择和配置来保证。3．推拉门窗的滑轮、毛条、防脱落密封器、下密封块是保证推拉门窗质量比较重要的配件。滑轮是门窗启闭是否顺畅的关键所在，应使用滚动轴尼龙轮。防脱落密封器是防止窗扇脱落的安全保障同时兼具勾企与上滑道之间的密封功能，应使用耐久比好的ABS塑料和三元乙丙橡胶。下密封块是起着勾企与下滑道之间的密封作用，可有效防止在波动荷载的作用下溅水现象的发生，应使用三元乙丙橡胶。毛条是窗扇与窗框的密封件，决定门窗气密性的优劣，普通化纤毛条遇水会卷曲而失去密封作用，必须使用硅化毛条。4．平开门窗的合页（或滑撑窗摩擦铰）、执手、框扇间的密封胶条是保证平开门窗质量最为重要的配件。合页（或滑撑窗的摩擦铰链）的承载能力是关系到门窗的安全和启闭是否顺畅的关键所在，合页的承载能力强于摩擦铰链，所以合页可制作分格较大的窗扇使用，摩擦铰链只适用于分格较小的窗或上悬窗。执手关系到门窗安全和密封性能的重要配件，普通执手只适用于在分格和荷载都较小的窗扇上使用，欧式多点执手适用于在分格和荷载都较大的窗扇上使用；框扇间的密封胶条是平开门窗气密性和水密性的保证，原生的PVC胶条的密封有效比约5年左右。再生的PVC胶条的则不具有密封的有效性，理想的是使用三元乙丙等耐候性好的橡胶。5．五金配件的型号、规格和性能应符合国家现行标准的有关规定。6．隐框窗使用的结构胶和耐候胶在使用前应与型材和玻璃作相容性试验。回答时间：2011-12-23
铝合金门窗的特点是什么？	第一，铝合金的耐久性好于同样使用在窗口的塑钢、木质等材料；第二，目前最常使用的铝合金门窗基本都是断桥的，也就是用隔热条将室内外的铝合金分离出来，这样就可以大大的提高了保温效果；另外配合中空玻璃共同使用之后，更是完全杜绝了室内结露现象的发生；第三，质轻、高强：铝合金材料多是空芯薄壁组合断面，方便使用，减轻重量，且截面具有较高的抗弯强度，做成的门窗耐用，变形小。??第四，密封性能好：铝合金本身易于挤压，型材的横断面尺寸精确，加工精确度高。可选用的防水性，弹性、耐久性都比较好的密封材料，比如橡胶压条和硅酮系列的密封胶。在型材方面，各种密封条固定凹槽，已经随同断面在挤压成型过程中一同完成，给安装封缝材料创造了有利条件。??第五，造型美观：铝合金表面经阳极电化处理后，可呈现古铅肝铜。金黄、银白等色，可任意选川，经过氧化光洁闪亮。窗扇框架大，可镶较大面积的玻璃，让室内光线充足明亮，增强了室内外之间立面虚实对比，让居室更富有层次。??第六，耐腐蚀性强：铝台金氧化层不褪色．不脱落，不需涂漆，易于保养，不用维修。回答时间：2011-12-23
铝合金门窗生产工序的问题.	1?材料及主要机具：?1.1?铝合金门窗：规格、型号应符合设计要求，且应有出厂合格证。?1.2?铝合金门窗所用的五金配件应与门窗型号相匹配。所用的零附件及固定件最好采用不锈钢件，若用其它材质，必须进行防腐处理。?1.3?防腐材料及保温材料均应符合图纸要求，且应有产品的出厂合格证。?1.4?325号以上水泥；中砂按要求备齐（重庆是特细砂地区，可在细砂中按比例加入小粒径鱼米石）。?1.5?与结构固定的连接铁脚、连接铁板，应按图纸要求的规格备好。并做好防腐处理。?1.6?焊条的规格、型号应与所焊的焊件相符，且应有出厂合格证。?1.7?嵌缝材料、密封膏的品种、型号应符合设计要求。?1.8?防锈漆、铁纱（或铝纱）、压纱条等均应符合设计要求，且有产品的出厂合格证。?1.9?密封条的规格、型号应符合设计要求，胶粘剂应与密封条的材质相匹配，且具有产品的出厂合格证。1.10?主要机具：铝合金切割机、手电钻、圆锉刀、半圆锉刀、十字螺丝刀、划针、铁脚、圆规、钢尺、钢直尺、钢板尺、钻子、锤子、铁锹、抹子、水桶、水刷子、电焊机、焊把线、面罩、焊条等。?2?作业条件：?2.1?结构质量经验收后达到合格标准，工种之间办理了交接手续。?2.2?按图示尺寸弹好窗中线，并弹好十5cm水平线，窗距外墙的进出线（即所谓外墙门窗的三线控制），以校正门窗洞口位置尺寸及标高是否符合设计图纸要求，如有问题应提前剔凿处理。?2.3?检查铝合金门窗两侧连接铁脚位置与墙体预留孔洞位置是否吻合，若有问题应提前处理，并将预留孔洞内的杂物清理干净。?2.4?铝合金门窗的拆包检查，将窗框周围的包扎布拆去，按图纸要求核对型号，检查外观质量和表面的平整度，如发现有劈棱、窜角和翘曲不平、严重超标、严重损伤、外观色差大等缺陷时，应找有关人员协商解决，经修整鉴定合格后才可安装。?2.5?认真检查铝合金门窗的保护膜的完整，如有破损的，应补粘后再安装。回答时间：2011-12-23
木门窗套施工常见的质量问题？	"窗洞口侧面不垂直：主要原因是没有垫木片找直，应返工垫平,用长尺测量无误后再装垫层板。??　　表面有色差、破损、腐斑、裂纹等：都必须更换饰面板解决。包门窗套使用木材应与门窗扇木质、颜色协调??饰面板与木线条色差不能大??木种应相同。??　　用手敲击门套侧面板有空鼓声,表明底层未垫衬大芯板,应拆除面板后加垫大芯板。回答时间：2011-12-22"
门窗扇与框缝隙大的原因？	"主要原因是安装时刨修不准及门窗框与地面不垂直,可将门窗扇卸下刨修至与框吻合后重新安装,如门窗框不垂直应在框板内垫片找直。回答时间：2011-12-22"
门扇开关不顺利的原因？	"主要原因是锁具安装有问题应将锁舌板卸下用凿子修理舌槽,调整门框锁舌口位置后再安装上锁舌板。回答时间：2011-12-22"
美国门窗U值怎么会低到小于0.21？？	注意英标和国标的单位：?1?BTU/h.ft2.?H?=?5.68?w/m2.k回答时间：2012-4-18
幕墙施工施工质量管理体系怎么写?	你是施工单位还是怎么的?如果是施工单位就找你的施工挂靠单位。他们收取管理费?理应给你这些东西。回答时间：2012-1-11
建筑幕墙设计与施工资质标准里面的要求会不会矛盾？	请老板升级您单位的资质吧，这些目前最多只能算是升级时的企业业绩。等到企业资质升级完成，上述业绩就可以作为合法的员工业绩了。回答时间：2011-12-16
幕墙施工的时埋件埋得位置参照的标准是什么？	"不用想太多了，埋件下单适当加大点，偏差个3-2公分是正常的，要是你非得很精确的预埋到某个轴位是不现实的，工人不会为了放预埋件而重新复核土建结构轴线，即使你预埋很精确还有可能在振捣混凝土的时候出现偏差，所以不用想太多，即使偏差大了以后还有后置的补救措施（一般很少出现）,所以，你画图根据土建结构标你的尺寸就行了，但是你要考虑好龙骨的分隔，埋件用得上与否与分隔有很大关系。回答时间：2011-12-16"
设计方案中有关玻璃幕墙的的问题？	最好能由设计院直接出相关的图纸，这样一些关于结构、设计意图等问题，可以协调解决，免去了后期一些不必要的麻烦；目前的现状是很多设计院无幕墙设计人员，只能建筑设计好了，主体结束了，再由幕墙设计单位进行二次设计，一些建筑设计的意图可能会实现的不够理想；鉴于幕墙设计的专业性，建设单位在做完了建筑设计后应该找幕墙设计单位做也对应的施工设计，时间要越早越好回答时间：2012-1-5
教玻璃幕墙的设计和施工分包有关问题？	1：由建设单位与分包单位签订合同，总包单位承担管理、监督、协调等工作.2:?设计费看合同约定了，一般有设计资质的幕墙施工单位都有自己的设计人员，他们既然想干这个工程肯定都要自己设计，当然也有建设单位给设计费的，我们这边的幕墙施工单位都是自己设计自己施工。3：审图中心的幕墙施工图审查费由建设单位承担，当然也看合同约定由施工单位承担也行，其实这些都是小钱，真正的几千万的幕墙工程，利润都是很高的。4：由设计施工单位与审图中心签订。回答时间：2011-12-16
"玻璃幕墙施工中,硅酮胶的使用应符合哪些规定？"	要有格证。是国家认证胶。25级回答时间：2011-12-13
