question	answer
铝门窗制作安装阶段出现渗漏应该怎么预防和控制？	a)门窗与洞口墙体周边的标准间隙应控制在25mm-40mm之间，其最大尺寸应不超过50mm，最小不小于20mm，窗框与外墙面有一定的距离，否则应采用细石混凝土浇捣修整后方可安装施工，严禁采用劣质砌体，如烧结泥砖或砂浆直接垫平;　　b)根据工程情况合理选用水泥砂浆填充法，一是先将砂浆充填于铝材型腔内后再上墙安装并进行二次充填;二是将铝框固定后再充填砂浆。两种方法各有优缺点，第一种可确保铝腔内不形成空鼓的现象，但在二次充填时易产生裂缝而漏水;第二种方法则易在下边框及两侧形成难以避免的充填不满而形成空鼓现象;　　c)水泥砂浆填充要控制水泥砂浆的配合比，一般是1：2.5，保证水泥砂浆的质量，推荐在水泥砂浆中添加防水剂提高水泥砂浆的防渗漏性能，注意养护，避免开裂;　　d)门窗边框四周的外墙面300mm范围内，增涂二道防水涂料以减少雨水渗漏的机会;　　e)引风面或雨水冲刷面为阻止雨水渗过门窗与墙体之间的充填材料，适当考虑止水挡板或其他防水涂膜，增加抗渗性能;　　f)窗框交接处要留有注胶槽，宽度5-8mm，嵌注密封材料时，应注意清除浮灰、砂浆等，使密封材料与窗框、墙体粘结牢固。同时检查密封材料是否连续，是否缺漏等情况，特别是转角交接位置是否有毛细孔存在;对贴面砖外墙应采用两道以上密封，避免拼缝毛细水渗透;　　g)调整垫块禁止残留于门窗框内，拆除后要及时进行二次填充密实，填充注意与基体的可靠粘结，除清除残渣外应基体湿润;　　h)室外窗台应低于室内窗台板20mm为宜，并设置顺水坡，雨水排放畅通，避免积水渗透。铝门窗与外墙要有一定的距离，避免雨水直接冲刷。　　i)门窗连接件的材质、规格，连接方法应符合当地《铝合金门窗技术规程》要求，及时用砼或砂浆封锚，避免在风荷载作用下产生移动而使密封材料产生裂缝。回答时间：2014-7-29
铝合金门窗在使用过程中应该如何保养？	在使用过程中，一定要注意开关门窗的力度，切勿猛开猛关，一定要轻轻适当关闭，如果开关不是很灵活了，一定要检查看看是否有东西卡住滑槽。要经常在开启合页放润滑油，以确保开启灵活。回答时间：2014-7-29
我的百科怎么连不上CAD	您好，你用的百科版本可能和当前CAD版本无法匹配，请更换低版本的CAD。回答时间：2014-7-29
结构计算变量初始化错误	用软件安装光盘或安装程序重新修复一下即可回答时间：2014-7-18
我的2004单机版怎么不能用了？	您好，2004版本属于早期版本了，电脑系统更新换代都会导致部分老版本无法在其上继续工作。请联系我公司办理软件升级，QQ712050351回答时间：2014-6-30
点支承式幕墙节点设计的注意事项有哪些？	1.索结构未采用拉力保护器　　通常采用点式幕墙实现不同基础的建筑物之间的联系，形成连续的美学概念；近年来，单层索网结构的应用也逐渐广泛。这类结构中的拉索轴向刚度较大，如果结构或支座发生较大位移，其内力会有很大升高，甚至会造成拉索破断，因此需要采用保护器（弹簧补偿器）进行补偿，以便吸收支座在常规条件产生的变形；在地震等极端条件下，如果变形很大，保护器内预设的构件可以发生断裂破坏，但是仍然要发挥作用，保证系统不至于坍塌崩溃，具有剩余强度。　　2.大跨屋面与立面幕墙未采用柔性连接缝　　大跨屋面可能会产生较大的变形，采用通常的构造一般无法满足要求，一般有以下方案：　　（1）采用连杆机构传力和吸收变形，采用风琴橡胶板进行密封；（2）采用长圆孔，但调节量有限。　　3.支承点的热桥问题　　四角支承、边部点支承的构件是点支承幕墙的主要传力构件，也是该类幕墙的热桥，处理不当会出现结露现象，采应取构造措施予以避免。　　4.玻璃肋与面板对缝　　这种设计方法将玻璃肋与面板的薄弱部位放在同一平面，更容易出现问题，如果错开，能起到相互的补偿作用。并且玻璃肋拼接的螺栓数量为每端两个为宜，超过两个可能带来其他问题。　　5.点支承用玻璃肋不夹胶　　点支承玻璃肋是结构构件，目前积累的经验不多，在GB/T21086-2007《建筑幕墙》中，没有给出玻璃肋挠度限值要求。但在实际应用中，常有玻璃肋不夹胶的设计，作为玻璃结构，必须具有可靠性，因此必须采用夹层玻璃。在采光顶中即玻璃梁，也是采光顶工程设计的难点，在已经报批的《采光顶与金属屋面工程技术规程》中也未对玻璃梁做出规定，幕墙设计时应当谨慎。　　6.正负风压承载力相差较大的支承结构　　建筑幕墙的支承结构应能承受正负风压作用，一些结构可能正压方向承载力较好，负风压方向则较差，工程中尽量避免采用，尤其在负风压起控制作用的部位。如果采用预应力的方法能够获得可靠的结构体系，也应定期进行检查，避免出现安全问题。　　7.平面桁架无平面外支承　　大跨度平面桁架在幕墙中有较多应用，对这些结构应进行侧向失稳验算，必要时增加侧向支承，避免侧向失稳，提高结构的可靠性。　　8.重力索缺失　　重力索在点支承幕墙中有较多应用，近年来的设计趋于废掉重力索，这是个误区。一些结构采用重力索，不仅满足系统的传力要求，还有利用于固定面板的位置，减少连接点附近的面板所受的弯矩作用，从而提高了系统的可靠性。　　9.玻璃肋侧向失稳　　玻璃肋侧向易失稳，对跨度较大的工程应采取构造措施进行加固，避免失稳。　　10.吊挂高度不合理　　吊挂玻璃是玻璃重力传递比较合理的构造，因此一般工程均可采用，但会带来成本上的提高。根据GB50210规定，玻璃高度超过4m时即要采用吊挂结构，过于苛刻。　　11.吊挂玻璃重力传递不合理　　吊挂玻璃时，下部应悬空设计，以便吸收玻璃因结构、温度等原因产生伸长或缩短变形，不能采用垫块垫死。　　12.吊挂全玻幕墙上下封口不传力　　全玻幕墙主要靠面板和玻璃肋传递荷载，因此玻璃肋上下两端应该固定，大面玻璃上下也要有相应构造处理，以便传递水平荷载。回答时间：2014-6-26
我想知道双层玻璃幕墙的优缺点都有哪些？	优点：　　隔声:双层玻璃幕墙由于外皮对于噪声的屏蔽作用，降低了室外噪音对于室内的影响。对城市中心区的，处于很强的交通噪音环境中的建筑尤其适宜。同时，双层玻璃幕墙可以在强噪音环境中，仍然可以引入自然通风，降低了建筑能耗。　　保温:在冬季，外层幕墙的存在加强了外围护结构的保温性能。通过双层玻璃幕墙之间空气的预热可以有效的降低建筑表面的热损失。而且由于内层幕墙温度相对较高，有利于室内的热舒适性。　　夜间通风降温:在炎热的夏季，遮阳伞建筑内部温度有可能过高。而双层玻璃幕墙并不是以直接开启方式通风，因而具有安全保护功能，这使得在夏季夜晚下班时间办公楼可以利用夜间凉爽空气，以自然通风的方式进行室内降温。　　双层玻璃幕墙的遮阳百叶安装在夹层内部，相对单层玻璃幕墙外挂百叶方式，这种方式更有利于保护百叶，尤其是某些功能复杂、造价昂贵的金属百叶，日晒雨淋不仅会减短使用寿命，也会影响其遮阳及反射效果。此外，外挂百叶往往产生环境噪音，由日本著名建筑师祯文彦设计的，位于德国慕尼黑郊外的高技术园采用了外挂式金属百叶，在微风中整日鸣响不已，而在双层玻璃幕墙间设置的百叶就没有这种问题。　　因外层幕墙的存在，降低了建筑内部的风压，以那热使得高层建筑中部分自由开窗通风成为可能，仅此一项便可大大降低高层建筑中机械通风所需的能耗。　　在建筑设计上，双层玻璃幕墙由于使用大面积的玻璃，使建筑获得很高的通透性。　　自然通风：双层玻璃幕墙一项很重要的优点就是可以允许自然通风。自然通风方式不但可以降低空调能耗，而且有利于提高环境的舒适性，增强人体健康。　　双层玻璃幕墙间层可以作为防火通道使用。　　节能：由于双层玻璃幕墙提高了建筑保温隔热性能，而且遮阳伞能够较长时间的进行自然通风，所以使建筑可以充分节省能源，降低能耗。　　缺点:　　1.相对于普通建筑，其外围护结构的造价增加1.5-2倍。　　2.夏季，在强烈的阳光照射下，夹层空气中往往温度过高，尤其是当双层玻璃幕墙之间间隔太小而遮阳效果不佳时，其温度有时会超过室外温度，使得通过开窗获得自然通风无法实现。　　建筑幕墙的清洁和维护费用增高。双层玻璃幕墙基于对当地气候以及高层建筑特殊的高空环境的考虑，在具备最基本的使用功能的同时，遮阳伞还对外界的不良气候和环境的影响有缓冲和削弱的作用，能够最大限度的降低对不可再生能源的依赖。这种设计思路和出发点对节约能源、创建一个可持续发展的未来必将具有深远的意义。回答时间：2014-6-26
金属幕墙有哪些装饰优点？	金属幕墙，是一种新型的建筑幕墙型式，用于装修。是将玻璃幕墙中的玻璃更换为金属板材的一种幕墙形式，但由于面材的不同两者之间又有很大的区别，所设计施工过程中应对其分别进行考虑。由于金属板材的优良的加工性能，色彩的多样及良好的安全性，能完全适应各种复杂造型的设计，可以任意增加凹进和凸出的线条，而且可以加工各种型式的曲线线条，给建筑师以巨大的发挥空间，倍受建筑师的青睐，因而获得了突飞猛进的发展。　　金属幕墙装饰作为一种极富有冲击力的建筑幕墙形式，备受青睐的优点主要原因有以下六点：　　1、金属属于轻量化的材质，减少了建筑结构和基础的负荷，为高层建筑外装提供了良好的饿选择条件。　　2、金属板的性能卓越，隔热、隔音、防水、防污、防蚀性能优良。　　3、无论交给你个、运输、安装、清洗等施工作业都较易实施。　　4、金属板具有优良的加工性能，色彩的多样化及良好的安全性，能完全适应各种复杂造型的设计，而且可以加工各种型式的曲线线条，给建筑师以巨大的发挥空间，扩展了幕墙设计师的设计空间。　　5、金属设计适应性强，根据不同的外观要求、性能要求和功能要求可设计与之适应的各种类型的金属幕墙装饰效果。　　6、性能价格比较高，维护成本非常低廉，使用寿命长。回答时间：2014-6-26
玻璃幕墙有哪些功能作用？	玻璃幕墙（reflection?glass?curtainwall），是指由支承结构体系与玻璃组成的、可相对主体结构有一定位移能力、不分担主体结构所受作用的建筑外围护结构或装饰结构。墙体有单层和双层玻璃两种。玻璃幕墙是一种美观新颖的建筑墙体装饰方法，是现代主义高层建筑时代的显著特征。2013年据鸟类保护志愿者组织FLAP（Fatal?Light?Awareness?Program）统计，仅在多伦多一地，每年就有一百万到九百万的候鸟死于这些玻璃幕墙。现代化高层建筑的玻璃幕墙采用了由镜面玻璃与普通玻璃组合，隔层充入干燥空气或惰性气体的中空玻璃。　　中空玻璃有两层和三层之分，两层中空玻璃由两层玻璃加密封框架，形成一个夹层空间；三层玻璃则是由三层玻璃构成两个夹层空间。中空玻璃具有隔音、隔热、防结霜、防潮、抗风压强度大等优点。据测量，当室外温度为－10℃时，单层玻璃窗前的温度为－2℃，而使用三层中空玻璃的室内温度为13℃。而在炎热夏天，双层中空玻璃可以挡住90%的太阳辐射热。阳光依然可以透过玻璃幕墙，但晒在身上大多不会感到炎热。使用中空玻璃幕墙的房间可以做到冬暖夏凉，极大地改善了生活环境。回答时间：2014-6-26
现代高层办公楼双层玻璃幕墙有哪些优点？	①绝热好，利于冬季保温，夏季隔热；②能更好地杜绝噪音和防火；③能优化选择性地利用自然采光；④遮阳系统可根据天气状况调节；⑤办公区可以自然通风，因为空气间层内的对角气流使得室内办公空间的空气静压小于双层幕墙空气间层的空气静压，从而形成一个空气压力差值，迫使室内不新鲜的空气被抽出；⑥办公空间的自然通风换气提高了工作空间的空气质量，减少室内综合征的发生。回答时间：2014-6-26
石材蜂窝板在性能上都有哪些要求？	石材蜂窝板在应用中，还有很多重要的性能需要我们去关注，如平拉粘接强度、滚筒剥离强度、耐热水性和耐温差性等对产品的质量和应用都有着重要的意义和影响。表4为石材蜂窝板的主要物理和力学性能要求。回答时间：2014-6-6
国内外哪些建筑幕墙采用的石材蜂窝板？	石材蜂窝板起源于上世纪的欧洲，由于它克服了传统石材重量重、强度低、脆性大的缺点，经过在欧洲和北美的发展，已成为一种重要的绿色、新型复合建筑装饰材料。自上世纪九十年代传入我国后．经过不懈的努力，我国的石材蜂窝板产品质量已有极大提高，应用技术也得到飞速发展，目前已用于内外建筑装饰，同时也应用到家具、电梯、车辆和轮船等领域，每年还有部分产品出口到欧美等地。　　石材蜂窝板在我国建筑幕墙上的应用已有十年以上的历史。陕西电信网管大厦是我国首座采用石材蜂窝板作为幕墙外装饰材料的的超高层建筑，完工于2001年，楼高160米，石材蜂窝板幕墙面积约20000?O，蜂窝板为铝蜂窝板。佛山52层的环球国际广场，楼高208米，石材蜂窝板幕墙面积约为12000?O，完工时间为2006年。其它还有常州市市民中心、杭州东部国际商务中心、杭州市市民中心、无锡市市民中心、杭州天工艺苑等一大片幕墙工程项目。　　巴克利大厦（Barclay?Tower）位于美国纽约曼哈顿金融中心区，是美国遭受911破坏后，于2008年春天重建完工的豪华、高端、现代化的57层商住大厦。建筑幕墙采用石材环氧玻纤蜂窝复合板，面积约为5100?O，板块尺寸为1.5m×1.5m和0.3m×0.3m。回答时间：2014-6-6
建筑幕墙采用的石材蜂窝板会有哪些问题出现？	石材蜂窝板虽然在我国以及世界各地的建筑外墙上得到应用，但作为一种新型的建筑材料，其在应用中还有很多问题需要去探讨和关注。如胶粘剂老化性能对产品耐久性的影响、不同材料间热膨胀系数对板材变形的影响、安装连接方法、不对称复合板饰面石材的弯曲强度计算以及石材蜂窝板的主要性能要求和质量控制等。回答时间：2014-6-6
我想了解一下建筑幕墙防火封堵构造技术规范及发展。	"针对建筑幕墙防火封堵构造的设计，在现有的建筑防火设计规范和相关规范中都作了相应的规定，如《高层建筑设计防火规范》GB50045-95（2005版）、《建筑设计防火规范》GB?50016-2006、《玻璃幕墙工程技术规范》JGJ102-2003、《建筑防火封堵应用技术规程》CECS?154:2003等。　　然而，现有的这些规定由于实施的年限较早，基本适用于不具有外墙外保温系统的建筑幕墙。在面对幕墙式建筑时，其有关建筑幕墙防火封堵构造的规定已满足不了实际情况的需要。?为此，公安消防部门出台了相关管理文件，与之关联的技术规范也正在作进一步的修编和完善中。　　1）在公通字[2009]46号《民用建筑外保温系统及外墙装饰防火暂行规定》第五条中规定，“幕墙式建筑当建筑高度小于24m时，保温材料的燃烧性能应为A级或B1级。其中，当采用B1级保温材料时，每层应设置水平防火隔离带；采用金属、石材等非透明幕墙结构的建筑，应设置基层墙体，其耐火极限应符合现行防火规范关于外墙耐火极限的有关规定；玻璃幕墙的窗间墙、窗槛墙、裙墙的耐火极限和防火构造应符合现行防火规范关于建筑幕墙的有关规定；基层墙体内部空腔及建筑幕墙与基层墙体、窗间墙、窗槛墙及裙墙之间的空间，应在每层楼板处采用防火封堵材料封堵。”。　　2）住房和城乡建设部标准定额司2012年8月20日对在编《建筑设计防火规范》GB?50016-2012的(报批稿)发出征求意见通知。在此报批稿中，第6.2.10条作为强制性条文规定“建筑幕墙应在每层楼板外沿设置耐火极限不低于?1.00h、高度不低于?0.8m?的不燃性实心墙或防火玻璃墙。幕墙与每层楼板、隔墙处的缝隙应采用防火封堵材料封堵。当建筑未设置符合本规范规定的外墙体时，双层幕墙中靠室内侧的幕墙耐火极限不应低于?1.00h，可开启外窗应采用乙级防火窗或耐火极限不低于?1.00h?的?C?类防火窗。”在第6.7.7条中，也根据公通字[2009]46号规定，对幕墙式建筑的外墙外保温系统作出了类似的规定。　　3）正在修编的《玻璃幕墙工程技术规范》JGJ102和《金属与石材幕墙工程技术规范》JGJ133，在原有规定的基础上，对相关内容作了更详细的要求。如对玻璃幕墙的防火封堵构造设计，提出沿窗槛墙或防火裙墙的上部和下部宜各设一道楼层间水平防火封堵；明确提出当采用一道防火封堵构造时，防火封堵构造宜设于窗槛墙或防火裙墙的下部；对防火封堵缝隙宽度不大于200mm时，上层水平防火封堵构造可采用岩棉或矿棉压实封堵缝隙后，上覆防火密封漆的构造做法。　　4）新编制的《人造板材幕墙工程技术规范》（报批稿）规定,采用人造板材幕墙结构的建筑，应在每层楼板外沿设置耐火极限不低于1.00h的不燃烧实体墙，该实体墙上沿至层间水平防火封堵构造上沿的高度应不低于0.8?m；人造板材幕墙与每层楼板、防火分区隔墙处的建筑缝隙应采用防火封堵材料封堵，其耐火性能应不低于现行国家标准《建筑设计防火规范》GB?50016对相邻的楼板、防火间隔墙的耐火性能要求；幕墙的防火封堵构造系统，应具有伸缩能力、密封性和耐久性；遇火时，在规定的耐火极限内应保持完整性、隔热性和稳定性。防火封堵系统所使用的材料应满足《防火封堵材料》GB?23864有关缝隙封堵材料的要求；幕墙与楼板、防火分区隔墙间的缝隙采用岩棉或矿渣棉封堵时，其填充厚度不应小于100?mm；其支撑材料应采用厚度不低于1.5?mm的镀锌钢板或其它符合现行国家标准《不燃无机复合板》GB?25970中规定的、且名义密度ρ不小于1.5g/cm3、厚度不小于10?mm的不燃无机复合板；承托板与幕墙结构和主体结构以及承托板之间的缝隙，应采用符合现行国家标准《防火封堵材料》GB?23864规定的缝隙封堵材料、防火密封胶或《建筑用阻燃密封胶》GB/T?24267规定的建筑用阻燃密封胶进行有效的密封。　　5）在2010年9月1日实行的《挤塑聚苯乙烯泡沫塑料板保温系统建筑构造》10CJ16国家建筑标准设计参考图中，也已根据公通字[2009]46号文的规定，增加了防火隔离带相关材料的技术性能要求和相关构造，对幕墙式外墙外保温系统的防火隔离带作了明确规定。回答时间：2014-6-6"
建筑幕墙防火封堵的作用	建筑幕墙防火封堵作为建筑防火构造中的一个重要环节，在以往的幕墙设计中，特别是在玻璃幕墙的层间防火封堵构造设计中已广泛采用。其首要的作用就是起到阻断烟气扩散的途径，最大效果的达到拯救人员生命的目的；其二就是要有效的阻断和减缓火焰的蔓延，防止火焰对人体和建筑构件的直接伤害。回答时间：2014-6-6
建筑幕墙发生火灾的危害及应对措施。	火灾发生时，它对建筑物和人体产生的危害是众所周知的。从我国近年来连续所发生的火灾，如2005年的上海世贸广场和南京青少年活动中心、2006年的乌鲁木齐城市大酒店、2007年的上海环球金融中心大厦、2008年的济南奥体中心、2009年的央视大厦、2010年的上海胶州路高层公寓及2011年的沈阳皇朝万鑫国际大厦等，均造成了重大经济损失和人员伤害，同时带来了极大的社会负面影响。　　在考虑防止和降低火灾危害时，我们首先要了解火灾危害产生的途径，特别是它对人体产生危害的主要途径。?从“美国消防协会NFPA”的火灾统计数据显示，在火灾发生时，因吸入过量烟毒气体导致人体窒息伤亡比例为75%；直接火灾伤亡比例为20%，火灾致使建筑结构破坏而致伤亡比例为5%。根据这一统计结果，我们可以看出，火灾产生的大量烟毒气，是造成火灾时人员损失的最直接因素。作为幕墙式建筑，当其发生火灾时，除了火势燃烧迅猛和激烈外，大量浓烟和有毒气的产生，对人体产生直接的危害。针对这一现象，在火灾发生时，为减缓火灾的发展，降低火灾的伤害和损失，除了在保温系统和幕墙的材料中选用耐火性能好的材料外，最有效的被动防火措施就是在建筑物中构建有效的排烟和防火构造等措施，来达到最大程度的减少人员伤亡，同时有效的起到减缓和阻止火焰蔓延的作用。回答时间：2014-6-6
我想了解一下幕墙式建筑火灾的燃烧特点。	"从我国近年来建筑外立面所发生的重大火灾分析，火灾的起因和蔓延基本上都处于建筑外立面的保温系统，然后再累及相应的建筑幕墙、外窗和室内空间。火灾基本形成了先室外后室内，先竖向后横向，先往上后逆向往下，火源借助外墙外保温系统及其与建筑幕墙间的空腔，逐层向上、向下、左右蔓延和攀爬的立体燃烧过程。形成这种现象的主要原因，是近年来建筑外墙外保温系统中大量采用阻燃烧性能较低的保温材料所引致的。而外墙外保温系统与建筑幕墙间的空腔，在无有效防火封堵构造措施的条件下，则成了抽烟助燃的通道和热量的积聚地，加剧了火焰的燃烧和蔓延。图1为采用喷涂聚氨酯（燃烧性能B2级，氧指数26%，喷涂厚度60mm。）作为外墙外保温系统，外侧具有铝塑复合板（燃烧性能B1级，氧指数42%～45%）幕墙的燃烧试验样板按照英国BS?8414-1《建筑外包覆系统防火性能试验方法》进行室内环境试验时，外墙外保温系统与建筑幕墙间空腔的温度变化曲线。<P?align=center><IMG?src=""""></P>　　从图中可见，在燃烧时间约为300秒时（5分钟），在幕墙层间防火封堵构造和铝塑复合板幕墙的阻隔下，通道内的温度基本保持在1800C以内，此时幕墙外侧的最高温度已达到7000C以上。当燃烧时间约为500秒（9分钟）后，由于铝塑复合板被烧穿，火焰直接作用于通道内，此时通道内温度逐渐升高，但趋势较缓慢，温度保持在3000C以下。当燃烧时间达到约700秒（约12分钟）以后，由于外保温系统的保护层遭到击破，引燃了保温材料，使得通道内温度产生跳跃式的急剧上升，此时温度达到5000C以上。当试验产生轰燃效应时，通道内最高温度已接近10000C，外保温和幕墙系统已基本烧毁。同时，由于热熔性保温材料燃烧时产生下趟的特点，更加是幕墙式建筑火灾产生向下蔓延的怪相。总之，外墙外保温系统所采用的易燃且具有极高热值的保温材料，及其对建筑的包裸程度和热熔性，加上空腔的作用，以及幕墙外层遮挡等因素，使得近年来的火灾发展及其迅猛、燃烧及其猛烈、扑救相当困难，形成了幕墙式建筑火灾所具有的独特特点。回答时间：2014-6-6"
