question	answer
内平开下悬窗适用于哪些窗型？	内平开下悬功能的最基本的窗型为矩形窗，它在今天的建筑业中广泛使用。不断推出的新一代五金件系列足以满足建筑师的各种要求。合理配置的五金件能提高平开下悬窗的经济性。特殊窗型，如没有中梃的对开窗，圆弧窗、带斜边的窗都可以设计成相应的内平开下悬窗。在设计没有中挺的对开窗时，总是将带假中挺的窗扇做成内平开，而对应的窗扇则可做成内平开下悬。在设计圆弧窗时应记住，圆弧和直线边必须有切点，否则绕性的传动器的延长件就难达到圆弧段。斜边窗的斜边同水平线的夹角应保持在25°～40°之间。不管是木材、塑钢或铝合金制造的窗户，只要型材尺寸符合要求、材质有保证，都可以使用内平开下悬五金件生产具有内平开下悬功能的窗户。对特殊的要求，还可以采用一些附件来解决，如微通风控制件，对开窗用传动器，平开和翻转限位器、防误操作件等等。此外还可以使用高科技的最新产品，如窗户开关自动定时器和报警器。回答时间：2018-5-9
什么是中悬窗？有哪些优点？	"中悬窗是指窗轴装在窗扇的左右边梃的中部，沿水平轴旋转的窗。通常上半扇向室内开启，下半扇向室外开启。向内开启部分占用室内空间，故窗扇不宜过高过宽，设计时可上下或左右数扇为一樘，唯最下扇转向室内部分应比人高。从构造上分靠框式和进框式两类。常用作楼梯、走道高窗和门上亮窗，以及工业建筑的侧窗，或气窗。面积较大时应装传动装置，常见的有拉绳式、蜗杆式、链盘式、电动式等。中悬窗玻璃损耗少，雨水不易飘入，管理方便，装磨砂玻璃时可兼作遮阳。它的优点是：1、通风性能佳。中悬窗具有最大的开启面积，几乎与进出窗口的面积相等，这样能够很厚的促进风在室内循环，有利于房屋室内空气流通，循环性强。通常中悬窗通风面积是上悬窗的倍数，适用于需要在面积通风的建筑，如商场，汽车站之类，中悬窗比较受青睐。2、实用性强。避免了内平开窗打开时占用室内空间，可以避免与室内靠窗的物品发生冲突，例如：热水汽、吸油烟机，橱柜、窗帘等进行干扰，同时可以避免小孩子碰头的危险。3、密封保温性能好。通过窗扇周围多锁点密封、锁闭，保证了门窗的密封效果及保温效果,可以使窗子的密封性大大增强。密封性能的增强，有利于提升房屋的保温性、隔音性、防尘性。回答时间：2018-5-9"
什么是下悬窗？为何行业中有不少门窗人将上悬窗称为下悬窗？	下悬窗是指合页（铰链）分别安装于窗下框与窗下梃相对应的部位上，沿水平轴向内或向外开启的窗。下悬窗通风较好，但不防雨，仅用于室内亮窗或换气窗。由于对国家标准不熟悉，不少门窗行业从业者将上悬窗称作下悬窗，将下悬窗称作上悬窗。其实，国标的定义很有规律，对于外窗，人站在室内侧观看合页（铰链）的位置，就是窗名称中的“上下左右”。回答时间：2018-5-9
什么是上悬窗？有哪些优点？	上悬窗是指合页（铰链）装于窗上侧，向内或向外开启的窗。上悬窗是后来才出现的一种铝合金、塑钢窗。它是在平开窗的基础上发展出来的新形式。它有两种开启方式，既可平开，又可从上部推开。平开窗关闭时，向内拉窗户的上部，可以打开一条10cm左右的缝隙，也就是说，窗户可以从上面打开一点，打开的部分悬在空中，通过铰链等与窗框连接固定，因此称为上悬式。它的优点是：1、通风性。因为内倒位置是平开窗的又一种开启方式，使房间同大自然的空气自然流通，室内空气清新，同时排除了雨水进入室内的可能性。清新的空气无疑为人们创造出舒适的居住环境。2、安全性。窗扇四周布置的联动五金件和执手在室内操作的各种功能，关闭时窗扇的四周都固定在窗框上，因此安全性和防盗性能极好。3、便于清洁窗户。简单操作联动执手，可使窗扇外面转到室内。使得清洗窗户的外表面既方便又安全。4、实用性。避免了内开窗打开时占用室内空间，不方便挂窗帘和装升降式挂衣杆。5、密封保温性能好。通过窗扇周围多点锁闭，保证了门窗的密封、保温效果。回答时间：2018-5-9
平时应该如何维护门窗来增强门窗的使用寿命？	平时要对门窗多留意，对门窗活动关节定期清洁，定期检查窗铰是否损坏、螺丝是否变形脱落等。门窗的使用寿命与门窗保养工作息息相关，老旧的门窗应该聘请专业人员定期上门检查维护。若门窗已损坏，在更换和拆除旧窗时，切记保留旧窗的外围圈框，这样可避免新窗安装后出现结构漏水的现象。回答时间：2017-7-28
南北地区的门窗在选购中还有哪些关键的性能需要注意呢？	"南方门窗选购：　　保温性能；考虑到南方地区的“湿冷”气候,特别是到了冬天,这股“湿冷”就更强烈了。针对此,要保证选择的门窗具有恰到好处的保温性能。　　降噪性能：面临“海浪声”的扰民这一情况,就得重点考虑到门窗的隔声降噪性能了。只有这样,才能在想“听海”的时候打开窗“听海”,想安静入睡时,关上窗便可安静进入梦乡。　　抗风压性能、水密性：南方地区的气候明显区别于内陆地区,通常多台风,降雨量大,非常潮湿。所以南方地区的门窗,首先要在抗风压、水密性上优于其他门窗产品。北方门窗选购：　　考虑到北方气候的特点，在门窗使用上有一些地方性规定，如：建筑物7层以上限用外开窗。最主要的是夏天闷热、冬天严寒，所以一扇隔温效果好的门窗能给居室带来不少的舒适，也能节省不少的能耗。　　门窗的物理性能指标有：抗风压性、气密性、水密性、保温隔热性、隔声性、采光性。门窗的机械性能，主要指门窗五金件得启闭力、反复启闭性能。这些性能都是门窗选购时候需要注意的。另外据调查，北方使用塑钢门窗比使用木门窗的房间冬季室内温度可高4D5度；北方地区使用双层玻璃效果更佳。回答时间：2020-3-13"
南北地区的门窗在性能方面有所侧重，应该如何选择呢？	根据气候特点，南北方门窗选择需要有不同的侧重。北方窗户在选择时要注意：由于气候寒冷，所以需要门窗隔热性能高，K值要低。①三玻双中空的断桥隔热窗比双面单中空玻璃的更加隔热，所以三玻双中空在北方销量高于南方，特别是在东北地区。②断桥平开窗比普通推拉窗的隔热性能好，北方建议用断桥平开窗或者装两道推拉窗。③为了提高整个房屋的保温性，北方地区窗户的面积较小。北方风沙、雾霭大，所以建议选择密封性能好的门窗。南方窗户在选择时要注意：①南方风大，沿海地区更是经常饱受台风施虐，所以产品在抗风压方面一定要强。门窗的铝型材壁厚、扇框宽度、厚度等都要加强。②南方雨水多，所以门窗在水密性方面也要足够好，防止雨水渗漏。而南方天气潮湿，对木材不利，所以铝木门窗在南方不如北方受欢迎。另外，为了防止雨水进入，阳台推拉门的下轨最好选择高低轨。③南方蚊虫多，容易传染疾病，所以最好装带纱窗的窗户，例如窗纱一体平开窗。回答时间：2020-3-13
门窗选择有南北差别这种说法吗？	门窗沟通室内外环境，室外环境情况影响着门窗的选择。中国幅员辽阔，南北地区在气候、环境方面有差别，所以在门窗的选择上也有所区别。北方气候特点：温度低，冬天非常寒冷，昼夜温差大；干燥；风沙较大，常有沙尘暴。南方气候特点：温暖，有的地方温度高，例如海南；常刮台风，特别是沿海地区；潮湿；蚊虫较多。回答时间：2020-3-13
门窗的安装工艺有哪些？	"门窗的上墙安装是成品安装的重要一环，俗话说""三分制作，七分安装""，所以说安装的环节是不可忽视的，它对门窗的使用以及日后的维护都起到非常关键的作用，因此需要由安装经验丰富的专业人员进行操作。门窗的安装根据不同的项目需求可分为泡沫胶密封和灌砂浆修缝两种。两种安装方法都可以将窗户外口固定密封，效果取决于安装师傅的经验和手艺。第一种打泡沫胶一般用在贴好瓷砖采用的方法，打胶是要稳、慢、静，同时仔细观察少打、漏打、不够均匀的及时修复。心情急躁，快速收场的大有人在，可是有没有想过出现漏水后把责任就推得一干二净就不好了，事情可大可小，只有用心才能出细活。第二种灌砂浆、主要用在毛坯房、没贴好瓷砖的、安装好窗户，将砂浆夯实缝隙中，有责任心的话等贴好瓷砖再打上一层玻璃胶，保证不会再漏水。回答时间：2020-3-13"
门窗的宽度有哪些要求？	关于窗户的宽度窗宽一般由0.6m开始，根据建筑标准洞口规范中的规定，一般建筑洞口的宽度模数是300mm，即一般宽度为600mm、900mm、1200mm、1500mm等以此类推。需注意的是，当窗洞过宽时，应加设竖向龙骨或“拼樘”，否者容易出现窗户的刚度问题。关于门的宽度一般住宅分户门0.9～1m，分室门0.8～0.9m，厨房门0.8m左右，卫生间门0.7～0.8m，由于考虑现代家具的搬入，现今多取上限尺寸。通常情况下，公共建筑的门宽一般单扇门1m，双扇门1.2～1.8m，再宽就要考虑门扇的制作，双扇门或多扇门的门扇宽以0.6～1.0m为宜。旅馆客房门洞宽度一般≥0.9m，卫生间门洞宽≥0.75m。回答时间：2020-3-13
门窗的高度有哪些要求？	"首先，关于窗台的高度：一般住宅建筑中，要求窗台高度不小于0.9m，当窗台高度低于0.8m时，应采取防护措施。在公共建筑中，窗台高度1.0～1.8m不等，开向公共走道的窗扇，其底面高度不应低于2.0m。关于窗户的高度一般住宅建筑中，窗的高度为1.5m，加上窗台高0.9m，则窗顶距地板面2.4m。而门窗的高度：在住宅建筑中应根据采光、通风、空间形象等要求来决定，但要注意窗户过高的刚度问题，必要时要加设横梁或""拼樘""。在公共建筑中，整块玻璃的高度有的已超过7.2m，那已不属于一般窗户的范围了。回答时间：2020-3-13"
窗有哪些开启方式呢？	通常我们按照开启方式的不同把门分为了六类：①平开窗：指窗扇向内或向外水平开启的木窗。平开窗具有制作方便的特点，是最为常用的一种窗，它广泛地应用于各种各样的场合。②固定窗：指没有活动窗扇的木窗。固定窗又分为固定玻璃窗和固定百叶窗两种基本类型。固定玻璃窗是将玻璃直接镶在窗框上，主要是采光用；固定百叶窗是将木百叶直接镶在窗上，主要供通风用。固定窗一般安装在走道、卫生间或一般窗的固定部位与平开、推拉窗配合使用。③推拉窗：是指窗扇上下或左右推拉开启的窗。根据推拉方向的不同又可分为水平推拉窗和垂直推拉窗两种。推拉窗具有开启中窗扇不占室内空间的特点。④转窗：指窗扇绕水平或垂直轴旋转实现开启的窗。转窗常用在大型建筑或一般建筑的楼梯间、走道的间接采光窗或门的亮窗等。⑤百叶窗：窗内面板含有百叶。⑥悬窗：悬窗的开启角度比平开窗小，通常为半开或小半开，分为上悬窗、下悬窗等。回答时间：2020-3-13
门有哪些开启方式呢？	"通常我们按照开启方式的不同把门分为了五类：①平开门：是指门扇以立梃为轴，水平开启的门。平开门是最为常用的一种门。根据其开启方向的不同，又分为内开和外开两种。平开门的开向主要是由其功能和开启后尽量少占室内空间的需要决定的。一般建筑内门常采用内开，而建筑外门和应急门常采用外开。②弹簧门：是指安装弹簧合页、门扇开启后能够自动闭合的木门。严格讲来，弹簧门应该说是平开门的一个特殊类型。弹簧门有单向和双向之分，单向弹簧门只能向一个方向开启而双向弹簧门则可以向两个方向开启。弹簧门一般用于出入人员多，但又需要常使门保持关闭的场合。③推拉门：是指门扇被沿宽度方向左右推拉移动实现开关的门。常见的推拉门有明装和暗装两种形式，明装推拉门是指推拉的门扇和轨道均在墙体外面，,而暗装推拉门是指门扇和轨道在墙体中间的推拉门。推拉门具有开合过程中占用空间小的特点，因而采用推拉门可以充分利用室内空间。④转门：是指以门扇中心线为轴旋转实现开关的门。转门具有开关能同时进行的特点。它既能保证人们的出入方便，又能始终保持对外界的隔离作用，因此多用于宾馆、酒店等出入人员多的场所的门庭门。⑤折叠门：折叠门是指开启过程门扇能够折叠的门。折叠门是开启方式较为特殊的一种门，它又可分为平开折叠门和推拉折叠门两种基本类型。由于折叠门在开启中门扇能够折叠，因而占用空间较小，特别是推拉折叠门，很大的门开启折叠之后，几乎可以不占什么空间，往往可以作为对室内空间重新分隔组合的一种有效方法--活隔断而平开折叠门则多用于面积很小的厕所或盥洗室等。回答时间：2020-3-13"
门窗的建筑设计通常会考虑哪些主要因素？	从建筑美学角度来看，门窗立面的分格要符合美学特点，分格设计时，要考虑如下因素：(1）门窗立面分格既要有一定的规律，又要体现变化，在变化中求规律；分格线条疏密有度；等距离、等尺寸划分显示了严谨、庄重、严肃；不等距自由划分则显示韵律、活泼和动感；(2)分格比例的协调性。就单个玻璃板块来说，长宽比尽量接近黄金分割比，不宜设计成正方形和长宽比达1:2以上的狭长矩形，亮子高度一般为框高的1/4~1/5，不宜太大或太小；(3)至少同一房间、同一墙面门窗的横向分格线条要尽量处于同一水平线上，竖向线条尽量对齐；(4)门窗立面设计时要考虑建筑的整体效果要求，比如建筑的虚实对比、光影效果、对称性等。回答时间：2020-3-13
双层幕墙要保证空气清洁，如何做？	双层幕墙的主要特征之一是具有热通道，通过合理设计热通道内空气的有序流动实现优良的热工性能。为保证空气的清洁，内通风双层幕墙应设置海绵过滤网，外通风幕墙应设置防虫网。回答时间：2019-1-28
双层幕墙的气流出现短路的原因？	外通风双层幕墙的通风方式很多，但不能出现气流短路现象，即下一个热通道排出的气流不应直接进入上一个热通道。回答时间：2019-1-28
内通风的双层幕墙怎么会和空调冲突？	内通风双层幕墙设有独立的强制排风系统，应该与中央空调等结合设计，如果出现不协调的情况，将很难处理，当然更不能用空调通风系统取代强制排风系统。回答时间：2019-1-28
后置的化学锚栓埋件，可以焊接吗？	在化学栓附近进行焊接作业，会较大幅度削弱化学栓的承载力，因此应尽量避免焊接作业或采取适当的焊接工艺避免对化学栓造成较大的影响。?可更换面板的构造，无疑会提高更换作业的安全性，更能确保幕墙的质量。裂，火焰直接对上一层幕墙构成威胁。因此设计时应避免玻璃跨越层间封堵，要确保玻璃炸裂，火焰上不去;封堵应严密，并防止串烟。回答时间：2019-1-28
超高层幕墙后期如何更换玻璃？	由于钢化玻璃不可避免的自曝，会使得更换玻璃的现象更为普遍。但对于超高层建筑或很难进行更换作业的建筑，按常规作业方法很难实施更换。如果在幕墙构造设计时采用室内即可更换面板的构造，无疑会提高更换作业的安全性，更能确保幕墙的质量。裂，火焰直接对上一层幕墙构成威胁。因此设计时应避免玻璃跨越层间封堵，要确保玻璃炸裂，火焰上不去;封堵应严密，并防止串烟。回答时间：2019-1-28
层间的防火封堵应该注意什么？	在GB50210《建筑装饰装修工程验收规范》、JGJ/T139《玻璃幕墙检验方法标准》中对幕墙的防火封堵有明确规定，当玻璃跨越层间封堵时，会有层间防火封堵与玻璃直接接触的设计，规范不允许，实际也存在问题。玻璃在250℃左右可能会炸裂，火焰直接对上一层幕墙构成威胁。因此设计时应避免玻璃跨越层间封堵，要确保玻璃炸裂，火焰上不去;封堵应严密，并防止串烟。回答时间：2019-1-28
800mm以上的落地玻璃，如何通过审查？	《民用建筑设计通则》GB50352和《住宅设计规范》GB50096对临空窗如何采用栏杆作出了规定，针对幕墙，一般采用在800mm位置处设置横梁，该横梁和楼面间采用夹层玻璃可以通过审查。??长城饭店，有永久的燕尾槽供擦窗机使用，即安全又便捷。回答时间：2019-1-28
幕墙工程都需要设置“擦窗机”吗？	建筑物清洗需要擦窗机，但遗憾的是很多工程的擦窗机并没有真正的发挥作用，一方面可能是管理问题，毕竟请专业的队伍清洗幕墙更为省事，另一方面擦窗机存在一定的风险，尤其在风比较大的时候，无法与幕墙相对固定，即没有擦窗机连接设计。在我国第一个幕墙工程长城饭店，有永久的燕尾槽供擦窗机使用，即安全又便捷。回答时间：2019-1-28
变形缝的设计原则有哪些？	　变形缝设计是一个难点，建筑师不能接受发生变形后有些构件或面板可以破坏的设计原则，因此变形缝应能够吸收变形(包括支承结构的变形、荷载作用、温度作用和地震作用)，并且不能降低该部位的物理性能，如气密性、水密性、抗风压和保温性能等性能。回答时间：2019-1-28
玻璃的安装应该注意什么？	玻璃的弯曲强度会随着时间的推移而下降，原因是玻璃表面的微裂纹会持续扩展，因此幕墙设计时，应使玻璃在自由的状态下工作。但实际工程中，确有玻璃在不必要的永久荷载作用下工作，例如强迫安装、压接密封等。??玻璃一旦破裂会导致小片玻璃失去连接而脱落。回答时间：2019-1-28
钢化玻璃可以进行磨砂处理吗？	经过磨砂处理的钢化玻璃，不管在钢化之前还是之后，均会破坏玻璃表面的应力分布，极易诱发玻璃的自曝，经磨砂处理的点支承玻璃危险性更大。狭长玻璃不宜采用短边支承。??些开启扇的设计中有所应用，这种设计大片玻璃一旦破裂会导致小片玻璃失去连接而脱落。回答时间：2019-1-28
中空玻璃“贴服”、“干涉”等现象，是什么原因？	面积较大中空玻璃，采用9mm中空层可能会出现吸附现象，因此中空层的尺寸应根据构造要求和热工要求综合确定。US>”是大小片中空玻璃的极端形式，在一些开启扇的设计中有所应用，这种设计大片玻璃一旦破裂会导致小片玻璃失去连接而脱落。回答时间：2019-1-28
中空玻璃的“大盖帽”会导致什么问题？	“大盖帽”是大小片中空玻璃的极端形式，在一些开启扇的设计中有所应用，这种设计大片玻璃一旦破裂会导致小片玻璃失去连接而脱落。回答时间：2019-1-28
中空玻璃的“大小片”设计好用吗？	中空玻璃采用大小片构造，在一些应用中具有一些优势，尤其可以为型材的设计提供更多的空间，但也存在很多不足：　　(1)不便采用机械注胶;　　(2)传力途径不合理，甚至可能导致玻璃间发生相对位移，最终导致中空玻璃漏气失效;　　(3)还有一些工程大小片中空玻璃间层部位未用结构胶。关于大小片的计算也存在一些争议，主要是在荷载分配方面，设计时应多加注意。回答时间：2019-1-28
小单元面板需要设置限位吗？	小单元面板挂接形式应用较广，其插接深度应达到要求，工程中时有掉扇的事故发生，对于开缝小单元，由于没有密封胶定位，应采取构造措施进行定位，否则框扇间插接可能失效，存在安全隐患。回答时间：2019-1-28
型材在设计时玻璃槽口“不变”还是“可变”好？	型材设计时，要考虑施工时的可操作性，采用可变槽口能够进行微调，且安装方便，因此尽可能不采用固定式玻璃槽口。回答时间：2019-1-28
钝角部位的弧型压接应注意什么？	采用传统的定距压板不能满足压接需要，应采用角度可调的连接构造。回答时间：2019-1-28
挂钩式开启扇的“防脱设计”如何实现？	幕墙开启窗通常采用上悬结构，但因为设计存在缺陷，工程中经常出现掉扇现象，个别工程在关闭状态下掉落的几率更高。主要原因是这些工程没有防脱设计，或挂钩防脱设计不合理，或挂钩的搭接深度不够，或挂接处型材壁厚太薄。回答时间：2019-1-28
穿条式隔热条可以承受剪力吗?	隔热条在隔热型材中起到结构传力、降低热量传递的作用，被幕墙型材广泛采用。穿条式结构形式，采用复合生产线将隔热条和铝合金型材强制压合。因此在隔热条与铝合金型材压合部位有冷作硬化现象，甚至存在一些微观裂纹缺陷。如果幕墙的横梁采用隔热型材，应采取构造措施，避免隔热条承受剪力，防止隔热条与铝合金型材连接部位发生破坏。一般采用托板或采用较强一侧铝合金型材承受玻璃重量。回答时间：2019-1-28
"隐框中空玻璃下部,需要设置托板吗？"	中空玻璃结构胶长期承受剪力，对结构胶使用寿命不利，因此JGJ02中要求在玻璃下部应设置托板。该托板与横梁直接连接比较合理，可以设计成卡接或螺栓连接;采用螺栓与玻璃组件的副框连接可能会影响结构胶的打注，存在质量缺陷，建议慎用。回答时间：2019-1-28
假明框隐框需要按隐框幕墙来设计吗?	假明框通常在隐框幕墙的接缝处加装一个装饰条，起到明框幕墙的装饰效果。这种结构应采用隐框幕墙的设计方法设计中空玻璃和结构胶，即第二道密封胶应采用硅酮结构胶密封。如果采用聚硫胶作为中空玻璃的第二道密封，尽管不一定在紫外线照射下破坏，仍然存在不安全的因素。回答时间：2019-1-28
隐框幕墙采用哪种压板最安全？	隐框幕墙和半隐框幕墙通常采用压板(压块)传力，其间距一般不大于300mm，有定距和非定距压板两种。定距压板通过连接螺栓紧固后其压接间隙比较固定，对玻璃面板副框的压紧力比较一致，便于吸收结构和温度等变形，减少摩擦噪音，并且能够避免因压块压得不均造成玻璃面板出现影像畸变现象。回答时间：2019-1-28
幕墙节能效果低下的原因？	热密线在节能铝合金窗的设计中有较广泛的应用，但在建筑幕墙的开启腔内应用较少，导致幕墙开启部位节能效果低下。回答时间：2019-1-28
用装饰盖和用螺钉连接的卡口，有什么区别？	装饰盖应与挤压型材的卡口相连接，这种卡口尺寸固定、精度较高，能够实现可靠的连接。通过螺钉连接后形成的卡口精度达不到要求，连接不可靠。回答时间：2019-1-28
大截面装饰条上，需要设置“滴水线”吗？	大截面装饰条上表面会有积灰，如果不设置滴水线，会造成幕墙表面出现较多流痕。如果在装饰条前端设置滴水线，能有效避免水和灰尘混合流到幕墙表面。回答时间：2019-1-28
横梁立柱间连接件采用“两点连接”可行吗?	幕墙横梁常常会出现“耷拉头”现象，其原因可能有：　　(1)横梁承载力不满足要求;　　(2)横梁和立柱的连接比较薄弱，比如横梁立柱间的连接件采用两个螺栓(钉)连接，由于其抗扭性能比较差，导致幕墙横梁发生扭转。回答时间：2019-1-28
明框幕墙在压盖压接时，应该注意什么？	明框幕墙采用压盖压接，一方面便于实现等压腔，另一方面可以与扣盖实现卡接。采用不连续的压盖(短压盖)，虽然可以降低成本，但会出现玻璃不平、等压腔无法形成等问题。回答时间：2019-1-28
